{
  "line_item_id": "juniper-line-item-001",
  "project_id": "918-juniper",
  "pricebook_item_id": "juniper-pricebook-001",
  "description": "Juniper planting bed",
  "quantity": 3.0,
  "unit": "ea",
  "extended_price": 142.5,
  "traceability": {
    "workbook_row_ref": "Estimate!7",
    "formula_refs": ["ext-price", "juniper-bed-ext-price"],
    "source_artifact_ids": ["source-juniper-ifc-lineage", "proof-ifc-cost-enrichment", "proof-estimation-contract"]
  }
}
