{
  "line_item_id": "rose-line-item-001",
  "project_id": "rose-residence",
  "pricebook_item_id": "rose-pricebook-001",
  "description": "Paver patio",
  "quantity": 240.0,
  "unit": "sf",
  "extended_price": 4320.0,
  "traceability": {
    "workbook_row_ref": "Estimate!12",
    "formula_refs": ["ext-price"],
    "source_artifact_ids": ["rose-workbook-external"]
  }
}
